{
  "$schema": "https://json-schema.org/draft/2020-12/schema",
  "$id": "https://wolftales.github.io/srd-builder/schemas/monster.schema.json",
  "version": "2.1.0",
  "last_modified": "2026-06-22",
  "title": "Monster",
  "type": "object",
  "additionalProperties": true,
  "required": [
    "id",
    "name",
    "simple_name",
    "armor_class",
    "hit_points",
    "ability_scores",
    "actions"
  ],
  "properties": {
    "id": {
      "type": "string",
      "pattern": "^(monster|creature|npc):[a-z0-9_]+$",
      "description": "Stable identifier for the monster entry (monster:, creature:, or npc: prefix)"
    },
    "simple_name": {
      "type": "string",
      "pattern": "^[a-z0-9_:]+$",
      "description": "Normalized identifier without the entity prefix"
    },
    "aliases": {
      "type": "array",
      "items": {
        "type": "string"
      },
      "uniqueItems": true,
      "description": "Alternative names or search terms for this monster"
    },
    "name": {
      "type": "string",
      "minLength": 1,
      "description": "Display name"
    },
    "armor_class": {
      "description": "Armor class structured object",
      "type": "object",
      "required": [
        "value"
      ],
      "properties": {
        "value": {
          "type": "integer",
          "minimum": 0,
          "description": "Base AC value"
        },
        "type": {
          "type": "string",
          "description": "Armor type (natural armor, plate, etc.)"
        },
        "type_id": {
          "type": "string",
          "pattern": "^[a-z0-9_:]+$",
          "description": "Normalized armor type identifier"
        },
        "notes": {
          "type": "string",
          "description": "Additional context (e.g., with shield)"
        }
      },
      "additionalProperties": false
    },
    "hit_points": {
      "description": "Hit point total or expression",
      "oneOf": [
        {
          "type": "integer",
          "minimum": 0
        },
        {
          "type": "string",
          "minLength": 1
        },
        {
          "type": "object",
          "additionalProperties": true
        }
      ]
    },
    "speed": {
      "type": "object",
      "description": "Movement speeds in feet",
      "properties": {
        "walk": {
          "type": "integer",
          "minimum": 0,
          "description": "Walking speed in feet"
        },
        "swim": {
          "type": "integer",
          "minimum": 0,
          "description": "Swimming speed in feet"
        },
        "fly": {
          "type": "integer",
          "minimum": 0,
          "description": "Flying speed in feet"
        },
        "burrow": {
          "type": "integer",
          "minimum": 0,
          "description": "Burrowing speed in feet"
        },
        "climb": {
          "type": "integer",
          "minimum": 0,
          "description": "Climbing speed in feet"
        },
        "hover": {
          "type": "boolean",
          "description": "Whether creature can hover while flying"
        },
        "notes": {
          "type": "string",
          "description": "Additional movement notes"
        }
      },
      "additionalProperties": false
    },
    "ability_scores": {
      "type": "object",
      "description": "Ability score block keyed by ability name",
      "minProperties": 1,
      "properties": {
        "strength": {
          "type": "object",
          "properties": {
            "value": {
              "type": "integer",
              "minimum": 1,
              "maximum": 30,
              "description": "Ability score value"
            },
            "modifier": {
              "type": "integer",
              "description": "Calculated ability modifier"
            }
          },
          "required": [
            "value",
            "modifier"
          ],
          "additionalProperties": false
        },
        "dexterity": {
          "type": "object",
          "properties": {
            "value": {
              "type": "integer",
              "minimum": 1,
              "maximum": 30,
              "description": "Ability score value"
            },
            "modifier": {
              "type": "integer",
              "description": "Calculated ability modifier"
            }
          },
          "required": [
            "value",
            "modifier"
          ],
          "additionalProperties": false
        },
        "constitution": {
          "type": "object",
          "properties": {
            "value": {
              "type": "integer",
              "minimum": 1,
              "maximum": 30,
              "description": "Ability score value"
            },
            "modifier": {
              "type": "integer",
              "description": "Calculated ability modifier"
            }
          },
          "required": [
            "value",
            "modifier"
          ],
          "additionalProperties": false
        },
        "intelligence": {
          "type": "object",
          "properties": {
            "value": {
              "type": "integer",
              "minimum": 1,
              "maximum": 30,
              "description": "Ability score value"
            },
            "modifier": {
              "type": "integer",
              "description": "Calculated ability modifier"
            }
          },
          "required": [
            "value",
            "modifier"
          ],
          "additionalProperties": false
        },
        "wisdom": {
          "type": "object",
          "properties": {
            "value": {
              "type": "integer",
              "minimum": 1,
              "maximum": 30,
              "description": "Ability score value"
            },
            "modifier": {
              "type": "integer",
              "description": "Calculated ability modifier"
            }
          },
          "required": [
            "value",
            "modifier"
          ],
          "additionalProperties": false
        },
        "charisma": {
          "type": "object",
          "properties": {
            "value": {
              "type": "integer",
              "minimum": 1,
              "maximum": 30,
              "description": "Ability score value"
            },
            "modifier": {
              "type": "integer",
              "description": "Calculated ability modifier"
            }
          },
          "required": [
            "value",
            "modifier"
          ],
          "additionalProperties": false
        }
      },
      "additionalProperties": false
    },
    "senses": {
      "type": "object",
      "required": [
        "passive_perception"
      ],
      "description": "Sensory abilities in feet",
      "properties": {
        "darkvision": {
          "type": "integer",
          "minimum": 0,
          "description": "Darkvision range in feet"
        },
        "blindsight": {
          "type": "integer",
          "minimum": 0,
          "description": "Blindsight range in feet"
        },
        "tremorsense": {
          "type": "integer",
          "minimum": 0,
          "description": "Tremorsense range in feet"
        },
        "truesight": {
          "type": "integer",
          "minimum": 0,
          "description": "Truesight range in feet"
        },
        "passive_perception": {
          "type": "integer",
          "minimum": 0,
          "description": "Passive Perception score"
        },
        "notes": {
          "type": "string",
          "description": "Additional sense notes (blind beyond this radius, etc.)"
        }
      },
      "additionalProperties": false
    },
    "damage_resistances": {
      "type": "array",
      "items": {
        "type": "object",
        "required": [
          "type"
        ],
        "properties": {
          "type": {
            "type": "string",
            "description": "Damage type (acid, cold, fire, etc.)"
          },
          "type_id": {
            "type": "string",
            "pattern": "^[a-z0-9_:]+$",
            "description": "Normalized damage type identifier"
          },
          "conditions": {
            "type": "string",
            "description": "Conditional resistance (nonmagical attacks, etc.)"
          }
        },
        "additionalProperties": false
      }
    },
    "damage_immunities": {
      "type": "array",
      "items": {
        "type": "object",
        "required": [
          "type"
        ],
        "properties": {
          "type": {
            "type": "string",
            "description": "Damage type (poison, psychic, etc.)"
          },
          "type_id": {
            "type": "string",
            "pattern": "^[a-z0-9_:]+$",
            "description": "Normalized damage type identifier"
          },
          "conditions": {
            "type": "string",
            "description": "Conditional immunity"
          }
        },
        "additionalProperties": false
      }
    },
    "damage_vulnerabilities": {
      "type": "array",
      "items": {
        "type": "object",
        "required": [
          "type"
        ],
        "properties": {
          "type": {
            "type": "string",
            "description": "Damage type"
          },
          "type_id": {
            "type": "string",
            "pattern": "^[a-z0-9_:]+$",
            "description": "Normalized damage type identifier"
          },
          "conditions": {
            "type": "string",
            "description": "Conditional vulnerability"
          }
        },
        "additionalProperties": false
      }
    },
    "condition_immunities": {
      "type": "array",
      "items": {
        "type": "object",
        "required": [
          "name"
        ],
        "properties": {
          "name": {
            "type": "string",
            "description": "Condition name (charmed, frightened, etc.)"
          },
          "condition_id": {
            "type": "string",
            "pattern": "^condition:[a-z0-9_]+$",
            "description": "Cross-reference to condition dataset"
          }
        },
        "additionalProperties": false
      }
    },
    "actions": {
      "type": "array",
      "items": {
        "type": "object",
        "required": [
          "name",
          "simple_name",
          "description"
        ],
        "properties": {
          "name": {
            "type": "string",
            "minLength": 1
          },
          "simple_name": {
            "type": "string",
            "pattern": "^[a-z0-9_]+$"
          },
          "description": {
            "type": "array",
            "items": {
              "type": "string",
              "minLength": 1
            },
            "minItems": 1,
            "description": "Array of paragraph strings describing the action/trait"
          },
          "attack_bonus": {
            "type": "integer",
            "description": "Attack bonus for weapon attacks"
          },
          "damage": {
            "type": "array",
            "items": {
              "type": "object",
              "required": [
                "dice"
              ],
              "properties": {
                "dice": {
                  "type": "string",
                  "pattern": "^\\d+d\\d+([+-]\\d+)?$",
                  "description": "Damage dice expression (e.g., 2d6+3, 1d4-1)"
                },
                "type": {
                  "type": "string",
                  "description": "Damage type (slashing, fire, etc.)"
                },
                "type_id": {
                  "type": "string",
                  "pattern": "^[a-z0-9_:]+$",
                  "description": "Normalized damage type identifier"
                }
              },
              "additionalProperties": false
            },
            "description": "Damage components for this action"
          },
          "dc": {
            "type": "object",
            "required": [
              "dc_value"
            ],
            "properties": {
              "dc_value": {
                "type": "integer",
                "minimum": 0,
                "description": "Difficulty Class value"
              },
              "dc_type": {
                "type": "string",
                "description": "Ability score for the saving throw"
              },
              "dc_type_id": {
                "type": "string",
                "pattern": "^ability:[a-z]+$",
                "description": "Ability score ID for cross-referencing"
              },
              "success_type": {
                "type": "string",
                "enum": [
                  "none",
                  "half",
                  "other"
                ],
                "description": "Effect on successful save: 'none' for no effect, 'half' for half damage, 'other' for special effects"
              }
            },
            "additionalProperties": false,
            "description": "Saving throw information"
          },
          "range": {
            "type": "object",
            "properties": {
              "reach": {
                "type": "integer",
                "minimum": 0,
                "description": "Melee reach in feet"
              },
              "normal": {
                "type": "integer",
                "minimum": 0,
                "description": "Normal range in feet"
              },
              "long": {
                "type": "integer",
                "minimum": 0,
                "description": "Long range in feet"
              }
            },
            "additionalProperties": false,
            "description": "Attack range information"
          }
        },
        "additionalProperties": true
      }
    }
  }
}
