{
  "id": "monster:example",
  "name": "example name",
  "simple_name": "example",
  "armor_class": {
    "value": 0
  },
  "hit_points": 0,
  "ability_scores": {
    "strength": {
      "value": 1,
      "modifier": 1
    }
  },
  "actions": [
    {
      "name": "example name",
      "simple_name": "example",
      "description": [
        "example description"
      ]
    }
  ]
}
